{
  "$schema": "../../schemas/device.schema.json",
  "id": "CHProPedals",
  "name": "CH Pro Pedals",
  "source": "edrefcard2",
  "ids": [
    {
      "bindsId": "CHProPedals",
      "usb": {
        "vid": "068E",
        "pid": "C0F2"
      }
    },
    {
      "bindsId": "068E00F2",
      "usb": {
        "vid": "068E",
        "pid": "00F2"
      }
    }
  ],
  "images": [
    {
      "file": "chpropedals.webp",
      "width": 3840,
      "height": 2160
    }
  ],
  "controls": [
    {
      "bindsId": "CHProPedals",
      "key": "Joy_XAxis",
      "label": "Left pedal",
      "kind": "axis",
      "image": 0,
      "box": {
        "x": 164,
        "y": 588,
        "w": 1332,
        "h": 162
      }
    },
    {
      "bindsId": "CHProPedals",
      "key": "Joy_YAxis",
      "label": "Right pedal",
      "kind": "axis",
      "image": 0,
      "box": {
        "x": 2264,
        "y": 588,
        "w": 1332,
        "h": 162
      }
    },
    {
      "bindsId": "CHProPedals",
      "key": "Joy_ZAxis",
      "label": "Rudder",
      "kind": "axis",
      "image": 0,
      "box": {
        "x": 1208,
        "y": 331,
        "w": 1332,
        "h": 162
      }
    },
    {
      "bindsId": "068E00F2",
      "key": "Joy_XAxis",
      "label": "Left pedal",
      "kind": "axis",
      "image": 0,
      "box": {
        "x": 164,
        "y": 588,
        "w": 1332,
        "h": 162
      }
    },
    {
      "bindsId": "068E00F2",
      "key": "Joy_YAxis",
      "label": "Right pedal",
      "kind": "axis",
      "image": 0,
      "box": {
        "x": 2264,
        "y": 588,
        "w": 1332,
        "h": 162
      }
    },
    {
      "bindsId": "068E00F2",
      "key": "Joy_ZAxis",
      "label": "Rudder",
      "kind": "axis",
      "image": 0,
      "box": {
        "x": 1208,
        "y": 331,
        "w": 1332,
        "h": 162
      }
    }
  ]
}
